location_id,country,state_region,lat,lon,aez,crop,season,historical_onset_avg_date,historical_onset_stddev_days,forecast_onset_2025,forecast_confidence,forecast_total_rainfall_mm,historical_avg_rainfall_mm,forecast_rainfall_anomaly_pct,dry_spell_risk_category,flood_risk_category,recommended_planting_date,adjusted_variety,variety_days_to_maturity,rationale
CL001,Nigeria,Kano,12.00,8.52,Sudan Savanna,Millet,Main 2025,Jun 10,±9 days,Jun 18,68%,520,580,-10%,HIGH,LOW,Jun 19,SOSAT-C88 (90-day),90,Forecast onset 8 days late. Deficit year likely. Short-season drought-tolerant variety essential. Avoid long-season millet.
CL002,Kenya,Kisumu,0.10,34.76,Lake Victoria Littoral,Maize,Long Rains 2025,Mar 15,±6 days,Mar 11,74%,1120,1050,+7%,LOW,MODERATE,Mar 12,H614D (130-day),130,Early onset with above-average rainfall. Waterlogging risk at low-lying plots. Use ridges. H614D tolerates wet better than DK8031.
CL003,Ethiopia,SNNPR,6.88,37.83,Moist Highland,Teff,Main Kiremt 2025,Jun 28,±5 days,Jun 24,71%,1260,1190,+6%,LOW,HIGH,Jun 26,Quncho DZ-Cr-387,95,Wetter than average forecast. Flash flood risk at river-proximate fields. Do not plant below 1800m elevation this season. Lodging risk — use Quncho.
CL004,Ghana,Northern,9.40,-0.85,Guinea Savanna,Sorghum,Main 2025,May 22,±8 days,May 29,65%,840,920,-9%,HIGH,LOW,May 31,Kapaala (105-day),105,Late onset + below-normal rainfall. Sorghum preferred over maize this season. Kapaala variety performs well under water stress.
CL005,Nigeria,Benue,7.73,8.52,Southern Guinea Savanna,Yam,Main 2025,Apr 5,±7 days,Apr 4,79%,1380,1310,+5%,LOW,MODERATE,Apr 5,Puna White (local),270,Near-normal onset. No planting date shift. Slight waterlogging risk at valley bottom plots in June-July window.
CL006,Tanzania,Dodoma,6.17,35.74,Semi-Arid,Sorghum,Vuli 2025,Oct 28,±12 days,Nov 6,54%,380,440,-14%,VERY HIGH,LOW,Nov 8,Pato (85-day),85,Very late onset with deficit forecast. HIGH risk season. Consider fallowing 50% of land. Plant only drought-hardy short-season variety. Probability of crop failure above 40% if onset delayed past Nov 15.
CL007,Senegal,Thiès,14.79,-16.92,Groundnut Basin,Millet,Main 2025,Jul 8,±10 days,Jul 15,62%,490,560,-12%,HIGH,LOW,Jul 17,Souna 3 (90-day),90,Below-normal rainfall year. Late onset. Only 90-day millet viable — longer season risks hitting dry end-of-rains. Skip groundnut this season.
CL008,Uganda,Mbale,1.07,34.18,East Highland,Beans,Short Rains 2025,Aug 30,±6 days,Aug 28,77%,670,640,+5%,LOW,LOW,Aug 29,NABE 4C (common bean),75,Near-normal season. Slightly early onset. No major shift. Above-average bean yield expected if fall armyworm managed.
